{"map_version":"1.0.0","name":"oval","description":"Closed 3.6 m x 2.0 m oval, represented by an ordered polyline.","units_per_meter":1,"line_width_m":0.02,"start":{"node":1,"toward":2},"nodes":[[1,4.3,0.0],[2,4.291333,0.098017],[3,4.265414,0.19509],[4,4.222493,0.290285],[5,4.162983,0.382683],[6,4.087458,0.471397],[7,3.996645,0.55557],[8,3.891419,0.634393],[9,3.772792,0.707107],[10,3.641908,0.77301],[11,3.500026,0.83147],[12,3.348514,0.881921],[13,3.18883,0.92388],[14,3.022512,0.95694],[15,2.851163,0.980785],[16,2.676431,0.995185],[17,2.5,1.0],[18,2.323569,0.995185],[19,2.148837,0.980785],[20,1.977488,0.95694],[21,1.81117,0.92388],[22,1.651486,0.881921],[23,1.499974,0.83147],[24,1.358092,0.77301],[25,1.227208,0.707107],[26,1.108581,0.634393],[27,1.003355,0.55557],[28,0.912542,0.471397],[29,0.837017,0.382683],[30,0.777507,0.290285],[31,0.734586,0.19509],[32,0.708667,0.098017],[33,0.7,0.0],[34,0.708667,-0.098017],[35,0.734586,-0.19509],[36,0.777507,-0.290285],[37,0.837017,-0.382683],[38,0.912542,-0.471397],[39,1.003355,-0.55557],[40,1.108581,-0.634393],[41,1.227208,-0.707107],[42,1.358092,-0.77301],[43,1.499974,-0.83147],[44,1.651486,-0.881921],[45,1.81117,-0.92388],[46,1.977488,-0.95694],[47,2.148837,-0.980785],[48,2.323569,-0.995185],[49,2.5,-1.0],[50,2.676431,-0.995185],[51,2.851163,-0.980785],[52,3.022512,-0.95694],[53,3.18883,-0.92388],[54,3.348514,-0.881921],[55,3.500026,-0.83147],[56,3.641908,-0.77301],[57,3.772792,-0.707107],[58,3.891419,-0.634393],[59,3.996645,-0.55557],[60,4.087458,-0.471397],[61,4.162983,-0.382683],[62,4.222493,-0.290285],[63,4.265414,-0.19509],[64,4.291333,-0.098017]],"edges":[[1,2],[2,3],[3,4],[4,5],[5,6],[6,7],[7,8],[8,9],[9,10],[10,11],[11,12],[12,13],[13,14],[14,15],[15,16],[16,17],[17,18],[18,19],[19,20],[20,21],[21,22],[22,23],[23,24],[24,25],[25,26],[26,27],[27,28],[28,29],[29,30],[30,31],[31,32],[32,33],[33,34],[34,35],[35,36],[36,37],[37,38],[38,39],[39,40],[40,41],[41,42],[42,43],[43,44],[44,45],[45,46],[46,47],[47,48],[48,49],[49,50],[50,51],[51,52],[52,53],[53,54],[54,55],[55,56],[56,57],[57,58],[58,59],[59,60],[60,61],[61,62],[62,63],[63,64],[64,1]]}
