{
  "map_version": "1.0.0",
  "name": "erth_grid",
  "description": "ERTH competition field: cleaned 87-node / 105-edge grid graph, all edges drivable.",
  "source": "https://github.com/snsnnd/ERTH @ ff56023a, NEW_Borad/mycode/top/map.c",
  "units_per_meter": 100.0,
  "line_width_m": 0.02,
  "start": {
    "node": 54,
    "toward": 53
  },
  "nodes": [
    [2, 50.0, 800.0], [3, 210.0, 800.0], [4, 370.0, 800.0], [5, 450.0, 800.0],
    [6, 530.0, 800.0], [7, 690.0, 800.0], [8, 770.0, 800.0], [9, 930.0, 800.0],
    [10, 50.0, 710.0], [11, 210.0, 710.0], [12, 290.0, 710.0], [13, 370.0, 710.0],
    [14, 450.0, 710.0], [15, 530.0, 710.0], [16, 610.0, 710.0], [17, 690.0, 710.0],
    [18, 850.0, 710.0], [19, 930.0, 710.0], [20, 50.0, 630.0], [21, 130.0, 630.0],
    [22, 210.0, 630.0], [23, 290.0, 630.0], [24, 370.0, 630.0], [25, 530.0, 630.0],
    [26, 690.0, 630.0], [27, 770.0, 630.0], [28, 850.0, 630.0], [29, 930.0, 630.0],
    [30, 210.0, 550.0], [31, 290.0, 550.0], [32, 450.0, 550.0], [33, 530.0, 550.0],
    [34, 610.0, 550.0], [35, 690.0, 550.0], [36, 850.0, 550.0], [37, 50.0, 470.0],
    [38, 130.0, 470.0], [39, 210.0, 470.0], [40, 290.0, 470.0], [41, 370.0, 470.0],
    [42, 690.0, 470.0], [43, 770.0, 470.0], [44, 850.0, 470.0], [45, 930.0, 470.0],
    [46, 290.0, 390.0], [47, 370.0, 390.0], [48, 450.0, 390.0], [49, 530.0, 390.0],
    [50, 610.0, 390.0], [51, 690.0, 390.0], [52, 770.0, 390.0], [53, 850.0, 390.0],
    [54, 930.0, 390.0], [55, 50.0, 310.0], [56, 130.0, 310.0], [57, 210.0, 310.0],
    [58, 290.0, 310.0], [59, 370.0, 310.0], [60, 450.0, 310.0], [61, 530.0, 310.0],
    [62, 610.0, 310.0], [63, 770.0, 310.0], [64, 850.0, 310.0], [65, 930.0, 310.0],
    [66, 50.0, 230.0], [67, 130.0, 230.0], [68, 290.0, 230.0], [69, 450.0, 230.0],
    [70, 530.0, 230.0], [71, 930.0, 230.0], [72, 610.0, 220.0], [73, 690.0, 220.0],
    [74, 210.0, 140.0], [75, 370.0, 140.0], [76, 530.0, 140.0], [77, 690.0, 140.0],
    [78, 770.0, 140.0], [79, 850.0, 140.0], [80, 930.0, 140.0], [81, 50.0, 60.0],
    [82, 130.0, 60.0], [83, 210.0, 60.0], [84, 290.0, 60.0], [85, 530.0, 60.0],
    [86, 690.0, 60.0], [87, 770.0, 60.0], [88, 930.0, 60.0]
  ],
  "edges": [
    [2, 3], [2, 10], [3, 4], [3, 11], [4, 5], [5, 6], [6, 7], [8, 9],
    [10, 11], [10, 20], [11, 12], [11, 22], [12, 13], [12, 23], [13, 4],
    [13, 24], [14, 5], [14, 15], [14, 32], [15, 6], [15, 25], [16, 17],
    [17, 7], [17, 26], [18, 19], [18, 28], [19, 9], [20, 21], [20, 37],
    [21, 22], [21, 38], [22, 30], [23, 24], [23, 31], [25, 26], [25, 33],
    [26, 27], [26, 35], [27, 8], [27, 28], [29, 45], [31, 32], [32, 48],
    [33, 34], [33, 49], [34, 35], [34, 50], [35, 36], [36, 44], [37, 38],
    [37, 55], [38, 39], [38, 56], [39, 40], [39, 57], [40, 46], [41, 47],
    [42, 43], [42, 51], [44, 45], [44, 53], [46, 47], [46, 58], [48, 49],
    [49, 61], [51, 52], [52, 53], [52, 63], [53, 54], [55, 56], [56, 57],
    [58, 59], [58, 68], [59, 60], [59, 75], [60, 69], [61, 62], [61, 70],
    [62, 63], [62, 72], [64, 65], [66, 67], [67, 68], [69, 70], [70, 76],
    [72, 73], [73, 77], [75, 76], [76, 77], [78, 63], [78, 77], [78, 79],
    [79, 64], [79, 80], [80, 71], [80, 88], [81, 66], [82, 67], [82, 83],
    [83, 74], [84, 68], [84, 85], [85, 76], [85, 86], [87, 88]
  ]
}
